Id,Channel,Subscribers,Title,URL,Released,Views,Category,Length
75iQA6AQPNg,The Daily Show,13.70M subscribers,"Is it already time for Trump's annual ""total and complete obliteration"" of Iran's nuclear program?",https://www.youtube.com/watch?v=75iQA6AQPNg,2026-02-24,433.6K views,Comedy,3:01
YrDoFKzdqIg,The Daily Show,13.70M subscribers,Trump had a public meltdown after the Supreme Court took away his tariff toy #dailyshow,https://www.youtube.com/watch?v=YrDoFKzdqIg,2026-02-24,4.2M views,Comedy,2:26
83_FleOdBqc,The Daily Show,13.70M subscribers,"All of MAGA celebrated Team USA's hockey win, even Kash ""Crazy Eyes"" Patel! #dailyshow",https://www.youtube.com/watch?v=83_FleOdBqc,2026-02-24,1.4M views,Comedy,2:54
Xa7yzso229U,The Daily Show,13.70M subscribers,A. Mechele Dickerson - Restoring the American Middle Class One Policy at a Time | The Daily Show,https://www.youtube.com/watch?v=Xa7yzso229U,2026-02-24,296.8K views,Comedy,17:36
fOdTHhQ1xY0,The Daily Show,13.70M subscribers,"Trump's Tariffs Voided, Kash Patel Crashes US Hockey Celebration, Iran War Looms | The Daily Show",https://www.youtube.com/watch?v=fOdTHhQ1xY0,2026-02-24,5.3M views,Comedy,25:57
n8uWKGmD_EY,The Daily Show,13.70M subscribers,"Kash Patel Simps for Team USA, NYC Blizzard Shuts In Parents & SCOTUS Enrages Trump | The Daily Show",https://www.youtube.com/watch?v=n8uWKGmD_EY,2026-02-24,104.7K views,Comedy,35:26
BV5q7HUVf0w,The Daily Show,13.70M subscribers,"First-class air travel is getting nicer and nicer every day: caviar, showers, unlimited farting",https://www.youtube.com/watch?v=BV5q7HUVf0w,2026-02-23,111.2K views,Comedy,2:17
U7pQwXjwSsk,The Daily Show,13.70M subscribers,Trump just realized his earthly immunity doesn’t apply to heaven #DailyShow @JoshJohnsonComedy,https://www.youtube.com/watch?v=U7pQwXjwSsk,2026-02-23,1.4M views,Comedy,2:37
AvPpsH7oi1A,The Daily Show,13.70M subscribers,"If you thought Eric Adams was weird as mayor, wait til you see how weird he is as not-mayor",https://www.youtube.com/watch?v=AvPpsH7oi1A,2026-02-23,623.1K views,Comedy,2:36
x3_d_mqY20s,The Daily Show,13.70M subscribers,Arizona Senator Mark Kelly on what Dems can do differently to gain the trust of the American people,https://www.youtube.com/watch?v=x3_d_mqY20s,2026-02-22,443.0K views,Comedy,2:36
NheRNBgcwdo,The Daily Show,13.70M subscribers,A groundbreaking new series inspired by the medical advice of RFK Jr.,https://www.youtube.com/watch?v=NheRNBgcwdo,2026-02-22,168.8K views,Comedy,2:11
U8LEn3PkGdM,The Daily Show,13.70M subscribers,It's time to play: Are these images Trump's skin or the surface of Mars? #dailyshow,https://www.youtube.com/watch?v=U8LEn3PkGdM,2026-02-21,2.1M views,Comedy,1:21
NZR25D85p64,The Daily Show,13.70M subscribers,NYU Professor Scott Galloway on how big tech companies are exploiting and warping young men,https://www.youtube.com/watch?v=NZR25D85p64,2026-02-21,677.4K views,Comedy,1:03
LIkAh4FsLEM,The Daily Show,13.70M subscribers,Desi Lydic finds out why Zohran Mamdani's red-baiting opponents are smearing him as a communist,https://www.youtube.com/watch?v=LIkAh4FsLEM,2026-02-20,338.1K views,Comedy,2:39
_G20-okc1EU,The Daily Show,13.70M subscribers,"Move over Milan, Grace Kuhlenschmidt is all about the robot Olympics",https://www.youtube.com/watch?v=_G20-okc1EU,2026-02-20,113.6K views,Comedy,1:20
42SVMeEJ4NI,The Daily Show,13.70M subscribers,"Trump Absolves Himself from Epstein Saga Before ""Million Mentions"" Bombshell | The Daily Show",https://www.youtube.com/watch?v=42SVMeEJ4NI,2026-02-20,894.4K views,Comedy,12:05
dsrYHNAqoek,The Daily Show,13.70M subscribers,A drug pricing announcement veered into a touching story about the president's neurotic fat friend,https://www.youtube.com/watch?v=dsrYHNAqoek,2026-02-19,1.7M views,Comedy,2:11
jDXkEcGygZg,The Daily Show,13.70M subscribers,"Gen Z thinks malls are cool now, which means Lewis Black can start shopping at Hot Topic again",https://www.youtube.com/watch?v=jDXkEcGygZg,2026-02-19,214.9K views,Comedy,1:45
RlTZ44AL9Z0,The Daily Show,13.70M subscribers,A PSA to anyone considering joining ICE: Don't #dailyshow,https://www.youtube.com/watch?v=RlTZ44AL9Z0,2026-02-18,360.0K views,Comedy,1:04
0uoClf9XmkM,The Daily Show,13.70M subscribers,"The best part of hosting? Being a real f**king diva, of course #AfterTheCut #DailyShow",https://www.youtube.com/watch?v=0uoClf9XmkM,2026-02-18,356.2K views,Comedy,1:54
r8oYM3aLVBw,The Daily Show,13.70M subscribers,Desi Lydic on Transitioning to Host from Correspondent - After The Cut | The Daily Show,https://www.youtube.com/watch?v=r8oYM3aLVBw,2026-02-18,315.0K views,Comedy,2:06
RbNkwkNiz1A,The Daily Show,13.70M subscribers,Director Park Chan-wook wants the film industry to find a way to get audiences to return to theaters,https://www.youtube.com/watch?v=RbNkwkNiz1A,2026-02-17,82.9K views,Comedy,2:41
U5EaG0XhwOo,The Daily Show,13.70M subscribers,Calling political opponents fascists and mocking victims of political violence? The GOP would NEVER,https://www.youtube.com/watch?v=U5EaG0XhwOo,2026-02-17,2.6M views,Comedy,2:44
l9Z8s4CcAdE,The Daily Show,13.70M subscribers,Is Ted Cruz a pair of $800 Ferragamo boat shoes? Because Tucker Carlson OWNED him #dailyshow,https://www.youtube.com/watch?v=l9Z8s4CcAdE,2026-02-16,801.4K views,Comedy,2:50
k2jNxLELIUc,The Daily Show,13.70M subscribers,"Kentucky Gov. Andy Beshear calls on Democrats to move away from consultant-class ""advocacy speak""",https://www.youtube.com/watch?v=k2jNxLELIUc,2026-02-16,412.8K views,Comedy,2:03
IUNCMgnxX7Y,The Daily Show,13.70M subscribers,Trump's History with Epstein Pt. 6 | The Daily Show,https://www.youtube.com/watch?v=IUNCMgnxX7Y,2026-02-16,1.9M views,Comedy,22:38
u5an1TMnjtk,The Daily Show,13.70M subscribers,"Actor and ""Superhero"" novelist Tim Blake Nelson dives into America's fascination with superheroes",https://www.youtube.com/watch?v=u5an1TMnjtk,2026-02-15,87.1K views,Comedy,2:12
IKnigih68bg,The Daily Show,13.70M subscribers,"French fries on the beach?! Fries go in your mouth, not the sea! #dailyshow",https://www.youtube.com/watch?v=IKnigih68bg,2026-02-15,183.9K views,Comedy,1:05
uVfdHPOCFmY,The Daily Show,13.70M subscribers,"At this point, shouldn't we just call them ""the Trump files featuring Jeffrey Epstein""?",https://www.youtube.com/watch?v=uVfdHPOCFmY,2026-02-14,834.6K views,Comedy,1:09
b5xIT9RS5rE,The Daily Show,13.70M subscribers,Mayor Jacob Frey on protecting cities from ICE crackdowns by speaking up and never backing down,https://www.youtube.com/watch?v=b5xIT9RS5rE,2026-02-14,250.7K views,Comedy,2:50
YuuPCogUQiA,The Daily Show,13.70M subscribers,Jon on MAGA's Anti-Bad Bunny Crusade & Klepper on Bondi's Congressional Crash Out | The Daily Show,https://www.youtube.com/watch?v=YuuPCogUQiA,2026-02-14,1.4M views,Comedy,51:27
6eAttuTjDlE,The Daily Show,13.70M subscribers,Sports War: Olympian Pees “F**k ICE” in the Snow & Figure Skater Channels Minions | The Daily Show,https://www.youtube.com/watch?v=6eAttuTjDlE,2026-02-13,688.7K views,Comedy,6:04
km4QYxOlJgM,The Daily Show,13.70M subscribers,"American “Digital Nomads” Swarm Mexico City, Angering Locals | The Daily Show",https://www.youtube.com/watch?v=km4QYxOlJgM,2026-02-13,543.6K views,Comedy,6:34
HV-m34NReCw,The F Word,1.50M subscribers,Five Delicious Dessert Recipes | The F Word | Gordon Ramsay,https://www.youtube.com/watch?v=HV-m34NReCw,2025-03-26,2.1K views,Entertainment,8:27
jEuNuL-B3tQ,The F Word,1.50M subscribers,The best way to prepare seared beef #GordonRamsay #TheFWord #Recipe #Cooking #CookingTips,https://www.youtube.com/watch?v=jEuNuL-B3tQ,2025-03-24,18.0K views,Entertainment,1:00
zoZCIQe8PZ8,The F Word,1.50M subscribers,Gordon Ramsay Tests His Patience | Full Episodes | The F Word,https://www.youtube.com/watch?v=zoZCIQe8PZ8,2025-03-23,2.7K views,Entertainment,1:34:38
QhifBqGmHbA,The F Word,1.50M subscribers,What Do These Celebrities Think About The Food? | The F Word | Gordon Ramsay,https://www.youtube.com/watch?v=QhifBqGmHbA,2025-03-19,2.2K views,Entertainment,8:14
Qp2SNnG2rfg,The F Word,1.50M subscribers,Gordon Ramsay's Wild Hunt: Catfish & Hog Wars! | Full Episodes | The F Word,https://www.youtube.com/watch?v=Qp2SNnG2rfg,2025-03-16,1.0K views,Entertainment,1:31:45
Dw-ZklJkEpw,The F Word,1.50M subscribers,Gordon's Cooking Tips Anyone Can Learn! | The F Word | Gordon Ramsay,https://www.youtube.com/watch?v=Dw-ZklJkEpw,2025-03-12,3.3K views,Entertainment,8:15
LRtaZFDSoOw,The F Word,1.50M subscribers,The secret to a perfect soufflé #GordonRamsay #TheFWord #Recipe #Cooking #CookingTips,https://www.youtube.com/watch?v=LRtaZFDSoOw,2025-03-10,8.6K views,Entertainment,1:00
OQUAFoMRUuw,The F Word,1.50M subscribers,Gordon Ramsay vs. Marines & Boy Band Chaos in the Kitchen! | Full Episodes | The F Word,https://www.youtube.com/watch?v=OQUAFoMRUuw,2025-03-09,3.7K views,Entertainment,1:31:43
JMRKYafhGSU,The F Word,1.50M subscribers,Gordon Brings Amateur Chefs Into His Kitchen | The F Word | Gordon Ramsay,https://www.youtube.com/watch?v=JMRKYafhGSU,2025-03-05,6.7K views,Entertainment,10:49
N2kDhZrBY_w,The F Word,1.50M subscribers,EVERY Challenge Gordon LOST (Season 5) | The F Word | Gordon Ramsay,https://www.youtube.com/watch?v=N2kDhZrBY_w,2025-02-26,46.3K views,Entertainment,8:05
9ZxfshMVs3k,The F Word,1.50M subscribers,It could be the very first F Word baby! #GordonRamsay #TheFWord #Recipe #Cooking,https://www.youtube.com/watch?v=9ZxfshMVs3k,2025-02-24,4.1K views,Entertainment,0:57
wqwafdQlk-w,The F Word,1.50M subscribers,EVERY Challenge Gordon LOST (Season 4) | The F Word | Gordon Ramsay,https://www.youtube.com/watch?v=wqwafdQlk-w,2025-02-19,74.6K views,Entertainment,8:08
LJiRR_SB99E,The F Word,1.50M subscribers,Victoria and David Beckham Save Gordon Ramsay's Lambs | Full Episodes | The F Word,https://www.youtube.com/watch?v=LJiRR_SB99E,2025-02-16,11.1K views,Entertainment,1:30:38
_ABDEyaCPM4,The F Word,1.50M subscribers,EVERY Challenge Gordon LOST (Season 3) | The F Word | Gordon Ramsay,https://www.youtube.com/watch?v=_ABDEyaCPM4,2025-02-12,599.0K views,Entertainment,12:09
n-qxY_OXUSg,The F Word,1.50M subscribers,There are no lumps in her mashed potato #TheFWord #Recipe #Cooking,https://www.youtube.com/watch?v=n-qxY_OXUSg,2025-02-10,11.1K views,Entertainment,0:34
hJEsm7Zjprg,The F Word,1.50M subscribers,Taste Test Goes HORRIBLY For Gordon Ramsay | Full Episodes | The F Word,https://www.youtube.com/watch?v=hJEsm7Zjprg,2025-02-09,3.7K views,Entertainment,1:31:07
v5jyKgc7Rvs,The F Word,1.50M subscribers,EVERY Challenge Gordon LOST (Season 2) | The F Word | Gordon Ramsay,https://www.youtube.com/watch?v=v5jyKgc7Rvs,2025-02-05,36.8K views,Entertainment,12:07
EBw57mfV5yg,The F Word,1.50M subscribers,EVERY Challenge Gordon LOST (Season 1) | The F Word | Gordon Ramsay,https://www.youtube.com/watch?v=EBw57mfV5yg,2025-01-29,116.7K views,Entertainment,23:40
6QKk7nxJX-Q,The F Word,1.50M subscribers,Here's how to prepare a leg of lamb 👆 #GordonRamsay #TheFWord #Recipe #Cooking,https://www.youtube.com/watch?v=6QKk7nxJX-Q,2025-01-27,3.7K views,Entertainment,1:00
xovF9z97aj8,The F Word,1.50M subscribers,John Thomson Uses His Favourite Gadgets | Full Episodes | The F Word | Gordon Ramsay,https://www.youtube.com/watch?v=xovF9z97aj8,2025-01-26,7.1K views,Entertainment,2:15:15
0A4s7_hnLP8,The F Word,1.50M subscribers,5 Must-Try Meat Recipes | The F Word | Gordon Ramsay,https://www.youtube.com/watch?v=0A4s7_hnLP8,2025-01-22,5.9K views,Entertainment,9:39
8tgGcT8O5ns,The F Word,1.50M subscribers,6 DELICIOUS Gordon Ramsay Recipes 🍴 | The F Word | The F Word | Gordon Ramsay,https://www.youtube.com/watch?v=8tgGcT8O5ns,2025-01-15,4.0K views,Entertainment,9:25
A2lr75d4iw0,The F Word,1.50M subscribers,One of the BEST cuts of meat! #GordonRamsay #TheFWord #Recipe #Cooking,https://www.youtube.com/watch?v=A2lr75d4iw0,2025-01-13,5.0K views,Entertainment,0:59
Ca1wuSwNnkQ,The F Word,1.50M subscribers,Gordon Ramsay Drags Jeremy Clarkson into Lobster Chaos! | Full Episodes | The F Word,https://www.youtube.com/watch?v=Ca1wuSwNnkQ,2025-01-12,31.0K views,Entertainment,1:34:03
BgDt2_Jmf9Q,The F Word,1.50M subscribers,Mouth-Watering Recipes From Season 4 | The F Word | Gordon Ramsay,https://www.youtube.com/watch?v=BgDt2_Jmf9Q,2025-01-09,3.7K views,Entertainment,8:08
_gCVy65pn0c,The F Word,1.50M subscribers,5 Recipes You MUST Try | The F Word | Gordon Ramsay,https://www.youtube.com/watch?v=_gCVy65pn0c,2025-01-01,5.1K views,Entertainment,9:15
MdapJtDUSPE,The F Word,1.50M subscribers,Cucumber brings this dish to a whole new level 🥒 #TheFWord #Recipe #Cooking,https://www.youtube.com/watch?v=MdapJtDUSPE,2024-12-30,5.9K views,Entertainment,0:38
6ICm8CO5tdU,The F Word,1.50M subscribers,4 Recipes You MUST Try! | The F Word | Gordon Ramsay,https://www.youtube.com/watch?v=6ICm8CO5tdU,2024-12-25,7.0K views,Entertainment,9:42
heMU0tfwMn8,The F Word,1.50M subscribers,Top 5 Recipes From Season 2 | The F Word | Gordon Ramsay,https://www.youtube.com/watch?v=heMU0tfwMn8,2024-12-18,3.8K views,Entertainment,11:20
_z_mF2el5M8,The F Word,1.50M subscribers,How to perfectly prepare fish with Chef Ramsay #TheFWord #GordonRamsay #FishCutting #CookingTips,https://www.youtube.com/watch?v=_z_mF2el5M8,2024-12-16,3.3K views,Entertainment,0:55
V1ouML41o-E,The F Word,1.50M subscribers,Gordon Ramsay Eats RARE Delicacy & Tests If Steak Can Boost Fertility! | Full Episodes | The F Word,https://www.youtube.com/watch?v=V1ouML41o-E,2024-12-15,6.0K views,Entertainment,1:33:01
vWUigXVFOZw,The F Word,1.50M subscribers,Delicious Recipes To Make At Home | The F Word | Gordon Ramsay,https://www.youtube.com/watch?v=vWUigXVFOZw,2024-12-11,4.8K views,Entertainment,8:54
WItvuhodJ-0,The F Word,1.50M subscribers,Gordon Ramsay vs Home Cook: Recipe Challenge + Joan Collins RETURNS! | Full Episodes | The F Word,https://www.youtube.com/watch?v=WItvuhodJ-0,2024-12-08,9.2K views,Entertainment,1:31:38
Hn-DzBKEVno,The F Word,1.50M subscribers,The BEST Recipes From Season 1 | The F Word | Gordon Ramsay,https://www.youtube.com/watch?v=Hn-DzBKEVno,2024-12-04,6.2K views,Entertainment,13:09
0L68MtHBk48,The F Word,1.50M subscribers,The results got Gordon Ramsay shook #TheFWord #GordonRamsay #TVShow #TVClips,https://www.youtube.com/watch?v=0L68MtHBk48,2024-12-02,37.5K views,Entertainment,0:58
HVqaqnI31Bg,The F Word,1.50M subscribers,Who Made The BEST Meals? | FULL EPISODES MARATHON | The F Word | Gordon Ramsay,https://www.youtube.com/watch?v=HVqaqnI31Bg,2024-12-01,11.5K views,Entertainment,3:10:29
hs0H-9rtVGc,The F Word,1.50M subscribers,"Gordon Challenges Kelly Brook, Ian Wright and Fay Ripley | The F Word | Gordon Ramsay",https://www.youtube.com/watch?v=hs0H-9rtVGc,2024-11-27,10.3K views,Entertainment,12:20
vNKkIpD6uU0,The F Word,1.50M subscribers,Dannii Minogue Makes Vegetarian Risotto | The F Word | Gordon Ramsay,https://www.youtube.com/watch?v=vNKkIpD6uU0,2024-11-25,3.9K views,Entertainment,5:02
HLp6pyYTyCU,The F Word,1.50M subscribers,INTENSE Restaurant Showdowns | TRIPLE EPISODE | The F Word | Gordon Ramsay,https://www.youtube.com/watch?v=HLp6pyYTyCU,2024-11-24,12.7K views,Entertainment,2:20:01
ycT2T3-hnQQ,The F Word,1.50M subscribers,"Gordon Cooks With Katie Price, Lenny Henry, and Rory Bremner | The F Word | Gordon Ramsay",https://www.youtube.com/watch?v=ycT2T3-hnQQ,2024-11-20,4.2K views,Entertainment,13:36
2oqgGyDLCsY,The F Word,1.50M subscribers,How did she fit all of those in there 😭? #TheFWord #GordonRamsay,https://www.youtube.com/watch?v=2oqgGyDLCsY,2024-11-18,13.4K views,Entertainment,0:56
irN2wbUAfOA,The F Word,1.50M subscribers,The BEST Local Restaurants? | TRIPLE EPISODE | The F Word | Gordon Ramsay,https://www.youtube.com/watch?v=irN2wbUAfOA,2024-11-17,20.3K views,Entertainment,2:18:41
CTRHBYCPsOM,The F Word,1.50M subscribers,Bringing Families Together | The F Word | Gordon Ramsay,https://www.youtube.com/watch?v=CTRHBYCPsOM,2024-11-13,3.8K views,Entertainment,11:37
PJyeiMB5OFA,The F Word,1.50M subscribers,Matt Dawson & Family Help Gordon In The Kitchen | The F Word | Gordon Ramsay,https://www.youtube.com/watch?v=PJyeiMB5OFA,2024-11-11,1.4K views,Entertainment,2:51
6m-IbLcKLmM,The F Word,1.50M subscribers,Gordon Teaches People The Joys Of Cooking | The F Word | Gordon Ramsay,https://www.youtube.com/watch?v=6m-IbLcKLmM,2024-11-06,3.9K views,Entertainment,15:37
yxJS_hSMV6Y,The F Word,1.50M subscribers,They burnt Chef Ramsay's famous scrambled eggs #TheFWord #GordonRamsay,https://www.youtube.com/watch?v=yxJS_hSMV6Y,2024-11-04,5.2K views,Entertainment,0:36
r0u1oTKpRMo,The F Word,1.50M subscribers,James Corden Bites Off More Than He Can Chew | The F Word | Gordon Ramsay,https://www.youtube.com/watch?v=r0u1oTKpRMo,2024-11-01,3.7K views,Entertainment,4:35
DM8OnfgatMg,The F Word,1.50M subscribers,Gordon Scaring Amateur Chefs Into Being Good | The F Word | Gordon Ramsay,https://www.youtube.com/watch?v=DM8OnfgatMg,2024-10-30,3.1K views,Entertainment,22:29
SkaPd2VbqbA,The F Word,1.50M subscribers,They DIDN'T Use Any Seasoning?! | FULL EPISODE | Season 4 - Episode 10 | The F Word,https://www.youtube.com/watch?v=SkaPd2VbqbA,2024-10-27,3.8K views,Entertainment,46:57
zB6PcWyrE3E,The F Word,1.50M subscribers,"Emma Bunton, Wendi Peters, and Angela Griffin Step Into The Kitchen | The F Word | Gordon Ramsay",https://www.youtube.com/watch?v=zB6PcWyrE3E,2024-10-23,3.7K views,Entertainment,13:35
QrE84PTMKFc,The Graham Norton Show,5.62M subscribers,How Joe Keery Became 'Djo' | The Graham Norton Show,https://www.youtube.com/watch?v=QrE84PTMKFc,2026-01-24,317.3K views,Entertainment,2:18
pUn9ORo488U,The Graham Norton Show,5.62M subscribers,Ant & Dec Weren't Always Famous | The Graham Norton Show,https://www.youtube.com/watch?v=pUn9ORo488U,2026-01-24,96.0K views,Entertainment,1:44
cW9QzMWA8v8,The Graham Norton Show,5.62M subscribers,Claire Foy 'Rhumbled' To An Ant & Dec Classic | The Graham Norton Show,https://www.youtube.com/watch?v=cW9QzMWA8v8,2026-01-23,93.2K views,Entertainment,1:31
_URfBQdQLrg,The Graham Norton Show,5.62M subscribers,Matt Damon is not Mark Wahlberg 👯‍♂️,https://www.youtube.com/watch?v=_URfBQdQLrg,2026-01-23,2.1M views,Entertainment,1:35
bLGV2iQaJHA,The Graham Norton Show,5.62M subscribers,Comedy Clash: Stephen Fry vs Hugh Laurie | The Graham Norton Show,https://www.youtube.com/watch?v=bLGV2iQaJHA,2026-01-22,780.4K views,Entertainment,29:52
UGBL3xfE9dA,The Graham Norton Show,5.62M subscribers,Zac Efron was left a little underwhelmed by his Spanish alter-ego! 🇪🇸,https://www.youtube.com/watch?v=UGBL3xfE9dA,2026-01-22,2.0M views,Entertainment,0:28
ueAYuek4Jnk,The Graham Norton Show,5.62M subscribers,Olivia Dean has Elton John’s seal of approval ✅,https://www.youtube.com/watch?v=ueAYuek4Jnk,2026-01-21,413.9K views,Entertainment,1:08
KJjmLSLPTsk,The Graham Norton Show,5.62M subscribers,Matt Damon Isn’t Mark Wahlberg | Extended Interview | The Graham Norton Show,https://www.youtube.com/watch?v=KJjmLSLPTsk,2026-01-21,130.7K views,Entertainment,9:55
ivvDY0yqkYM,The Graham Norton Show,5.62M subscribers,Wunmi Mosaku's adorable acting origin story 🥛,https://www.youtube.com/watch?v=ivvDY0yqkYM,2026-01-21,289.2K views,Entertainment,1:34
7R0te76EqZM,The Graham Norton Show,5.62M subscribers,Zac Efron Meets His Spanish Self  | Classic Clip | The Graham Norton Show,https://www.youtube.com/watch?v=7R0te76EqZM,2026-01-20,116.3K views,Entertainment,2:54
LdZt47_0gnU,The Graham Norton Show,5.62M subscribers,Erin Doherty’s X-rated Golden Globes speech 🤬,https://www.youtube.com/watch?v=LdZt47_0gnU,2026-01-20,367.4K views,Entertainment,1:20
n70yayAChFw,The Graham Norton Show,5.62M subscribers,Hollywood's Wildest Animal Encounters: Primate Edition | The Graham Norton Show,https://www.youtube.com/watch?v=n70yayAChFw,2026-01-19,71.7K views,Entertainment,35:00
uL9W5OCjAjY,The Graham Norton Show,5.62M subscribers,There are only TWO Idris Elbas 👯‍♂️,https://www.youtube.com/watch?v=uL9W5OCjAjY,2026-01-19,844.5K views,Entertainment,1:43
x2FZtCCl2HQ,The Graham Norton Show,5.62M subscribers,"S22 NYE - The Graham Norton Show | Full Episode | Hugh Jackman, Zac Efron, Zendaya, Gary Oldman",https://www.youtube.com/watch?v=x2FZtCCl2HQ,2026-01-18,62.4K views,Entertainment,47:35
SBl-5hfYjMI,The Graham Norton Show,5.62M subscribers,Olivia Dean Has Elton John’s Seal Of Approval | The Graham Norton Show,https://www.youtube.com/watch?v=SBl-5hfYjMI,2026-01-18,124.9K views,Entertainment,1:13
UByELziWcjY,The Graham Norton Show,5.62M subscribers,Wunmi Mosaku's Adorable Acting Origin Story | The Graham Norton Show,https://www.youtube.com/watch?v=UByELziWcjY,2026-01-17,49.2K views,Entertainment,1:39
8DeWGSpFNK4,The Graham Norton Show,5.62M subscribers,Erin Doherty’s X-Rated Golden Globes Speech | The Graham Norton Show,https://www.youtube.com/watch?v=8DeWGSpFNK4,2026-01-17,71.2K views,Entertainment,1:25
7YacZtelanY,The Graham Norton Show,5.62M subscribers,There Are Only Two Idris Elbas | The Graham Norton Show,https://www.youtube.com/watch?v=7YacZtelanY,2026-01-16,101.2K views,Entertainment,1:48
CFCje62DM5w,The Graham Norton Show,5.62M subscribers,Martin Freeman has a very specific fear 🥑,https://www.youtube.com/watch?v=CFCje62DM5w,2026-01-16,667.0K views,Entertainment,0:59
oDyApZP6svQ,The Graham Norton Show,5.62M subscribers,UK vs USA Rock Gods On The Graham Norton Show,https://www.youtube.com/watch?v=oDyApZP6svQ,2026-01-15,229.4K views,Entertainment,28:06
5MsqSDgww7w,The Graham Norton Show,5.62M subscribers,Julie Walters vs the Entire Concept of Talk Shows 😅,https://www.youtube.com/watch?v=5MsqSDgww7w,2026-01-15,4.4M views,Entertainment,1:28
rl0Dc1BxjDQ,The Graham Norton Show,5.62M subscribers,Rob Beckett thinks the 'A' in AI stands for 'Awful' 🤖,https://www.youtube.com/watch?v=rl0Dc1BxjDQ,2026-01-14,277.8K views,Entertainment,0:57
C8-HlCJzb88,The Graham Norton Show,5.62M subscribers,Martin Freeman Is Terrified Of Avocados | Extended Interview | The Graham Norton Show,https://www.youtube.com/watch?v=C8-HlCJzb88,2026-01-14,57.5K views,Entertainment,9:37
JQIVvtAR8a8,The Graham Norton Show,5.62M subscribers,Cynthia Erivo gives Graham a 'Wicked' gift 💚,https://www.youtube.com/watch?v=JQIVvtAR8a8,2026-01-14,2.0M views,Entertainment,1:29
UwMC05DeD6g,The Graham Norton Show,5.62M subscribers,Julie Walters Doesn’t Understand Talk Shows | Classic Clip | The Graham Norton Show,https://www.youtube.com/watch?v=UwMC05DeD6g,2026-01-13,130.9K views,Entertainment,2:26
ZKGmnTpKx34,The Graham Norton Show,5.62M subscribers,Dawn French was nearly in 'Mamma Mia!' 🥲,https://www.youtube.com/watch?v=ZKGmnTpKx34,2026-01-13,1.9M views,Entertainment,2:38
8SueIVyr0p8,The Graham Norton Show,5.62M subscribers,The Lord Of The Rings 25th Anniversary Celebration | The Graham Norton Show,https://www.youtube.com/watch?v=8SueIVyr0p8,2026-01-12,469.7K views,Entertainment,36:10
BdhVqmP1bKI,The Graham Norton Show,5.62M subscribers,Chris Pratt's unique Christmas present from Arnold Schwarzenegger 🎅,https://www.youtube.com/watch?v=BdhVqmP1bKI,2026-01-12,1.5M views,Entertainment,1:19
jZFZ55EFntM,The Graham Norton Show,5.62M subscribers,"S22 E12 - The Graham Norton Show | Full Episode | Will Smith, Jenna Coleman, Jamie Oliver",https://www.youtube.com/watch?v=jZFZ55EFntM,2026-01-11,39.8K views,Entertainment,37:09
dc63_Veh3dQ,The Graham Norton Show,5.62M subscribers,Rob Beckett Thinks The 'A' in AI Stands For Awful | The Graham Norton Show,https://www.youtube.com/watch?v=dc63_Veh3dQ,2026-01-11,38.7K views,Entertainment,1:02
G2Y9AMGy4IM,The Graham Norton Show,5.62M subscribers,Cynthia Erivo Gives Graham A 'Wicked' Gift | The Graham Norton Show,https://www.youtube.com/watch?v=G2Y9AMGy4IM,2026-01-10,103.2K views,Entertainment,1:34
rJilOS6z51o,The Graham Norton Show,5.62M subscribers,Dawn French Was Nearly In 'Mamma Mia!' | The Graham Norton Show,https://www.youtube.com/watch?v=rJilOS6z51o,2026-01-10,82.5K views,Entertainment,2:43
s4_7etFfZtI,The Graham Norton Show,5.62M subscribers,Chris Pratt's Unique Christmas Present From Arnold Schwarzenegger | The Graham Norton Show,https://www.youtube.com/watch?v=s4_7etFfZtI,2026-01-09,167.4K views,Entertainment,1:24
DtnKBj_FV4o,The Graham Norton Show,5.62M subscribers,Chris Pratt & Rebecca Ferguson Show No 'Mercy' | The Graham Norton Show,https://www.youtube.com/watch?v=DtnKBj_FV4o,2026-01-08,557.4K views,Entertainment,23:29
kjso9kIjSP8,The Graham Norton Show,5.62M subscribers,Tim Key is fully exposed 😬,https://www.youtube.com/watch?v=kjso9kIjSP8,2026-01-07,944.5K views,Entertainment,2:00
6rzWKYJ1elI,The Graham Norton Show,5.62M subscribers,Cynthia Erivo Made Olivia Colman Cry | Extended Interview | The Graham Norton Show,https://www.youtube.com/watch?v=6rzWKYJ1elI,2026-01-07,105.5K views,Entertainment,11:18
pyZid4kjsuY,The Graham Norton Show,5.62M subscribers,Cynthia Erivo STUNS Olivia Colman with her incredible talent 🎶,https://www.youtube.com/watch?v=pyZid4kjsuY,2026-01-07,1.1M views,Entertainment,2:08
ctkQxD56nys,The Graham Norton Show,5.62M subscribers,Tom Hiddleston’s Dad is his biggest fan 🥹,https://www.youtube.com/watch?v=ctkQxD56nys,2026-01-06,745.4K views,Entertainment,1:43
_tO38gAaZMs,The Graham Norton Show,5.62M subscribers,Matt Smith Squared 🤯 | Classic Clip | The Graham Norton Show,https://www.youtube.com/watch?v=_tO38gAaZMs,2026-01-06,82.5K views,Entertainment,3:57
gnCwfZxSEjg,The Graham Norton Show,5.62M subscribers,Matt Smith Squared 🤯,https://www.youtube.com/watch?v=gnCwfZxSEjg,2026-01-06,2.3M views,Entertainment,0:28
0ryKOd27CkA,The Graham Norton Show,5.62M subscribers,Comedy Clash: Joanna Lumley vs Dawn French | The Graham Norton Show,https://www.youtube.com/watch?v=0ryKOd27CkA,2026-01-05,517.7K views,Entertainment,35:02
kq0IVNNqRk4,The Graham Norton Show,5.62M subscribers,Laura Dern is a Swiftie icon 💅,https://www.youtube.com/watch?v=kq0IVNNqRk4,2026-01-05,117.0K views,Entertainment,1:47
